{
  "schemaVersion": 2,
  "id": "2026-09-30",
  "reportDate": "2026-09-30",
  "title": "9月30日学习内容",
  "items": [
    {
      "id": "english-ants-and-pants",
      "category": "english",
      "mode": "learn",
      "lesson": {
        "id": "english-ants-and-pants",
        "version": 2,
        "url": "lessons/english-ants-and-pants-v2.json"
      }
    }
  ]
}
